Author,Reference,Extractor_1,duplicate,preDM_def,combined_def,n_def,subgroup,mort_report,cardiomort_report,CVD_report,CHD_report,stroke_report,HF_report,CKD_report,cohort_name,country,year_pub,years_study,mean_followup,multivar_adjust,var_adjust,n_participants,n_females,mean_age_1,mean_age_F,mean_age_M,FSG_unit,mean_FSG,mean_FSG_F,mean_FSG_M,percent_HBA1C,percent_HBA1C_F,percent_HBA1C_M,percent_CVD,percent_CVD_M,percent_CVD_F,mean_GFR,mean_GFR_F,mean_GFR_M,outcome_type,n_mort,n_mort_F,n_mort_M,HR_mort_F,LCI_mort_F,UCI_mort_F,HR_mort_M,LCI_mort_M,UCI_mort_M,n_cardiomort,n_cardiomort_F,HR_cardiomort_F,LCI_cardiomort_F,UCI_cardiomort_F,HR_cardiomort_M,LCI_cardiomort_M,UCI_cardiomort_M,n_stroke,n_stroke_F,HR_stroke_F,LCI_stroke_F,UCI_stroke_F,HR_stroke_M,LCI_stroke_M,UCI_stroke_M,n_iscstroke,n_iscstroke_F,HR_iscstroke_F,LCI_iscstroke_F,UCI_iscstroke_F,HR_iscstroke_M,LCI_iscstroke_M,UCI_iscstroke_M,n_hemstroke,n_hemstroke_F,HR_hemstroke_F,LCI_hemstroke_F,UCI_hemstroke_F,HR_hemstroke_M,LCI_hemstroke_M,UCI_hemstroke_M,CVD_def,n_CVD,n_CVD_F,HR_CVD_F,LCI_CVD_F,UCI_CVD_F,HR_CVD_M,LCI_CVD_M,UCI_CVD_M,CHD_def,n_CHD,n_CHD_F,HR_CHD_F,LCI_CHD_F,UCI_CHD_F,HR_CHD_M,LCI_CHD_M,UCI_CHD_M,CKD_def,n_CKD,n_CKD_F,HR_CKD_F,LCI_CKD_F,UCI_CKD_F,HR_CKD_M,LCI_CKD_M,UCI_CKD_M,n_HF,n_HF_F,HR_HF_F,LCI_HF_F,UCI_HF_F,HR_HF_M,LCI_HF_M,UCI_HF_M
"European Diabetes Epidemiology Group, 2001",3. Glucose tolerance and cardiovascular mortality: comparison of fasting and 2-hour diagnostic criteria. Arch Intern Med 2001;161(3):397-405.,Tyler,1,1,NA,1,6.1-6.9 mmol/L,1,1,0,0,0,0,0,DECODE,Europe (various),2001,NA,NA,1,"age, center, BMI, systolic blood pressure, serum cholesterol level, smoking status",21062,6686,53,NA,NA,NA,NA,NA,NA,NA,NA,NA,NA,NA,NA,NA,NA,NA,0,485.58,27.9,,1.2,0.81,1.79,1.1,0.99,1.22,138.929,11.16,1.53,0.81,2.9,1.03,0.85,1.25,NA,NA,NA,NA,NA,NA,NA,NA,NA,NA,NA,NA,NA,NA,NA,NA,NA,NA,NA,NA,NA,NA,NA,NA,NA,NA,NA,NA,NA,NA,NA,NA,NA,NA,NA,NA,NA,NA,NA,NA,NA,NA,NA,NA,NA,NA,NA,NA,NA,NA,NA,NA,NA,NA,NA,NA,NA,NA,NA
"European Diabetes Epidemiology Group, 2001",3. Glucose tolerance and cardiovascular mortality: comparison of fasting and 2-hour diagnostic criteria. Arch Intern Med 2001;161(3):397-405.,Tyler,1,2,NA,1,7.8 - 11 mmol/L,1,1,0,0,0,0,0,DECODE,Europe (various),2001,NA,NA,1,"age, center, BMI, systolic blood pressure, serum cholesterol level, smoking status",21062,6623,NA,NA,NA,NA,NA,NA,NA,NA,NA,NA,NA,NA,NA,NA,NA,NA,0,558.944,95.172,,1.25,0.98,1.58,1.42,1.28,1.57,192.31,38.808,1.28,0.88,1.86,1.34,1.12,1.6,NA,NA,NA,NA,NA,NA,NA,NA,NA,NA,NA,NA,NA,NA,NA,NA,NA,NA,NA,NA,NA,NA,NA,NA,NA,NA,NA,NA,NA,NA,NA,NA,NA,NA,NA,NA,NA,NA,NA,NA,NA,NA,NA,NA,NA,NA,NA,NA,NA,NA,NA,NA,NA,NA,NA,NA,NA,NA,NA
"Hu et al., 2003",10. Hu G. Gender difference in all-cause and cardiovascular mortality related to hyperglycaemia and newly-diagnosed diabetes. Diabetologia 2003;46(5):608-17.,Modupe,2,5,WHO FPG + OGTT 2hPG ,1,PreDM,1,1,0,0,0,0,0,DECODE,Europe (various),2003,NA,8.3,1,"adjusted for age, centre, BMI, systolic blood pressure, total cholesterol and smoking.",16482,8867,55.30532702,55.39290628,55.20334865,0,5.344509162,5.27322657,5.43,,NA,NA,NA,NA,NA,NA,NA,NA,0,1606,584,,1.31,NA,NA,1.19,NA,NA,613,186,1.25,NA ,NA,1.25,NA,NA,NA,NA,NA,NA,NA,NA,NA,NA,NA,NA,NA,NA,NA,NA,NA,NA,NA,NA,NA,NA,NA,NA,NA,NA,NA,NA,NA,NA,NA,NA,NA,NA,NA,NA,NA,NA,NA,NA,NA,NA,NA,NA,NA,NA,NA,NA,NA,NA,NA,NA,NA,NA,NA,NA,NA,NA,NA,NA,NA
"McNeill et al., 2005","18. McNeill AM, Rosamond WD, Girman CJ, Golden SH, Schmidt MI, East HE, et al. The metabolic syndrome and 11-year risk of incident cardiovascular disease in the atherosclerosis risk in communities study. Diabetes Care 2005;28(2):385-90.",Tyler,3,0,NA,0,100-125 mg/dL,0,0,0,1,0,0,0,ARIC,USA,2005,1987-1999,11,1,"age, race/ARIC center, LDL cholesterol, and smoking.",12089,6881,54,54,54,1,NA,NA,NA,NA,NA,NA,NA,NA,NA,NA,NA,NA,0,NA,NA,,NA,NA,NA,NA,NA,NA,NA,NA,NA,NA,NA,NA,NA,NA,NA,NA,NA,NA,NA,NA,NA,NA,NA,NA,1.9,1.25,2.89,1.52,1.05,2.18,NA,NA,NA,NA,NA,NA,NA,NA,NA,NA,NA,NA,NA,NA,NA,NA,NA,"Incident CHD included fatal or nonfatal hospitalized myocardial infarction, fatal CHD, silent myocardial infarction identified by electrocardiography, or coronary revascularization.",NA,NA,2.11,1.64,2.72,1.39,1.18,1.63,NA,NA,NA,NA,NA,NA,NA,NA,NA,NA,NA,NA,NA,NA,NA,NA,NA
"McNeill et al., 2006","24. McNeill AM, Katz R, Girman CJ, Rosamond WD, Wagenknecht LE, Barzilay JI, et al. Metabolic syndrome and cardiovascular disease in older people: The cardiovascular health study. J Am Geriatr Soc 2006;54(9):1317-24.",Modupe,4,1,NA,1,6.1-6.9 mmol/L,0,0,0,1,0,0,0,CHS (cardiovascular health study),USA,2006,1989-2001,11,1,adjusted for age and race.,3585,2229,72,72.06078959,73.01017699,NA,NA,NA,NA,NA,NA,NA,NA,NA,NA,NA,NA,NA,0,NA,NA,,NA,NA,NA,NA,NA,NA,NA,NA,NA,NA,NA,NA,NA,NA,NA,NA,NA,NA,NA,NA,NA,NA,NA,NA,NA,NA,NA,NA,NA,NA,NA,NA,NA,NA,NA,NA,NA,NA,NA,NA,NA,NA,NA,NA,NA,NA,NA,"first occurrence of angina pectoris, MI, CABG, or angioplasty or CHD death.",116,60,1.31,1.02,1.68,1.45,1.15,1.83,NA,NA,NA,NA,NA,NA,NA,NA,NA,NA,NA,NA,NA,NA,NA,NA,NA
"McNeill et al., 2006","24. McNeill AM, Katz R, Girman CJ, Rosamond WD, Wagenknecht LE, Barzilay JI, et al. Metabolic syndrome and cardiovascular disease in older people: The cardiovascular health study. J Am Geriatr Soc 2006;54(9):1317-24.",,4,0,NA,1,5.6-6.9 mmol/L,0,0,0,1,0,0,0,CHS (cardiovascular health study),USA,2006,1989-2001,11,1,adjusted for age and race.,3585,2229,72,72.06078959,73.01017699,NA,NA,NA,NA,NA,NA,NA,NA,NA,NA,NA,NA,NA,0,NA,NA,,NA,NA,NA,NA,NA,NA,NA,NA,NA,NA,NA,NA,NA,NA,NA,NA,NA,NA,NA,NA,NA,NA,NA,NA,NA,NA,NA,NA,NA,NA,NA,NA,NA,NA,NA,NA,NA,NA,NA,NA,NA,NA,NA,NA,NA,NA,NA,"first occurrence of angina pectoris, MI, CABG, or angioplasty or CHD death.",264,139,1.08,0.89,1.31,1.28,1.05,1.57,NA,NA,NA,NA,NA,NA,NA,NA,NA,NA,NA,NA,NA,NA,NA,NA,NA
"Doi et al., 2010","47. Doi Y, Ninomiya T, Hata J, Fukuhara M, Yonemoto K, Iwase M, et al. Impact of glucose tolerance status on development of ischemic stroke and coronary heart disease in a general Japanese population: the Hisayama study. Stroke 2010;41(2):203-9.",Modupe,5,2,NA,1,7.8-11.0 mmol/L,0,0,0,1,1,0,0,Hisayama study,Japan ,2009,1988-2002,14,1,"Multivariable adjustment was made for age, systolic blood pressure, electrocardiogram abnormalities, body mass index, total and high-density lipoprotein cholesterol, smoking habits, alcohol intake, and regular exercise.",2130.165,1249.752,NA,NA,NA,NA,NA,NA,NA,NA,NA,NA,NA,NA,NA,NA,NA,NA,0,NA,NA,,NA,NA,NA,NA,NA,NA,NA,NA,NA,NA,NA,NA,NA,NA,NA,NA,NA,NA,NA,NA,NA,NA,24,13,0.88,0.46,1.7,0.91,0.44,1.89,NA,NA,NA,NA,NA,NA,NA,NA,"Combination of CHD and Ischemic stroke: CHD included acute myocardial infarction, silent myocardial infarction, sudden cardiac death within 1 hour after the onset of acute illness, and coronary artery disease treated by coronary artery bypass surgery or angioplasty.In principle, stroke was defined as a sudden onset of nonconvulsive and focal neurological deficit persisting for  24 hours. The diagnosis and classification of stroke were determined on the basis of clinical information, including brain CT and MRI, cerebral angiography, echocardiography, carotid duplex imaging, or autopsy findings.",48,19,NA,NA,NA,NA,NA,NA,"CHD included acute myocardial infarction, silent myocardial infarction, sudden cardiac death within 1 hour after the onset of acute illness, and coronary artery disease treated by coronary artery bypass surgery or angioplasty.",24,6,0.82,0.31,2.15,1.11,0.62,2,NA,NA,NA,NA,NA,NA,NA,NA,NA,NA,NA,NA,NA,NA,NA,NA,NA
"Doi et al., 2010","47. Doi Y, Ninomiya T, Hata J, Fukuhara M, Yonemoto K, Iwase M, et al. Impact of glucose tolerance status on development of ischemic stroke and coronary heart disease in a general Japanese population: the Hisayama study. Stroke 2010;41(2):203-9.",,5,1,NA,1,6.1-6.9 mmol/L,0,0,0,1,1,0,0,Hisayama study,Japan ,2009,1988-2002,14,1,"Multivariable adjustment was made for age, systolic blood pressure, electrocardiogram abnormalities, body mass index, total and high-density lipoprotein cholesterol, smoking habits, alcohol intake, and regular exercise.",2130.165,1249.752,NA,NA,NA,NA,NA,NA,NA,NA,NA,NA,NA,NA,NA,NA,NA,NA,0,NA,NA,,NA,NA,NA,NA,NA,NA,NA,NA,NA,NA,NA,NA,NA,NA,NA,NA,NA,NA,NA,NA,NA,NA,9,7,1.89,0.82,4.34,0.41,0.1,1.74,NA,NA,NA,NA,NA,NA,NA,NA,"Combination of CHD and Ischemic stroke: CHD included acute myocardial infarction, silent myocardial infarction, sudden cardiac death within 1 hour after the onset of acute illness, and coronary artery disease treated by coronary artery bypass surgery or angioplasty.In principle, stroke was defined as a sudden onset of nonconvulsive and focal neurological deficit persisting for  24 hours. The diagnosis and classification of stroke were determined on the basis of clinical information, including brain CT and MRI, cerebral angiography, echocardiography, carotid duplex imaging, or autopsy findings.",15,8,NA,NA,NA,NA,NA,NA,"CHD included acute myocardial infarction, silent myocardial infarction, sudden cardiac death within 1 hour after the onset of acute illness, and coronary artery disease treated by coronary artery bypass surgery or angioplasty.",6,1,0.48,0.06,3.76,0.8,0.31,2.05,NA,NA,NA,NA,NA,NA,NA,NA,NA,NA,NA,NA,NA,NA,NA,NA,NA
"Khang et al., 2010","48. Khang YH, Cho SI, Kim HR. Risks for cardiovascular disease, stroke, ischaemic heart disease, and diabetes mellitus associated with the metabolic syndrome using the new harmonised definition: findings from nationally representative longitudinal data from an Asian population. Atherosclerosis 2010;213(2):579-85.",Tyler,6,0,NA,0,100-125 mg/dl,0,0,1,1,1,0,0,K-NHANES,South Korea,2010,1998-2005,5.8,1,"model I adjusted for survey year (1998 and 2001) and age (age and age squared); model II adjusted for cigarette smoking, LDL cholesterol, alcohol consumption, and physical exercise as well as the covariates in model I; model III adjusted for socioeconomic status (education and household income), marital status, family history, and resting heart rate as well as the covariates in model II.",9791,5400,43.21030538,43.3,43.1,1,93.86908385,93.6,94.20,NA,NA,NA,NA,NA,NA,NA,NA,NA,1,NA,NA,,NA,NA,NA,NA,NA,NA,NA,NA,NA,NA,NA,NA,NA,NA,184,96,0.83,0.55,1.27,0.83,0.54,1.29,NA,NA,NA,NA,NA,NA,NA,NA,NA,NA,NA,NA,NA,NA,NA,NA,stroke and ischaemic heart disease constituted cardiovascular disease,288,142,0.93,0.66,1.3,0.92,0.66,1.29,"ICD codes for ischaemic heart disease (I20–I25),",122,59,1.34,0.8,2.25,1.04,0.63,1.73,NA,NA,NA,NA,NA,NA,NA,NA,NA,NA,NA,NA,NA,NA,NA,NA,NA
"Kokubo et al., 2010","49. Kokubo Y, Okamura T, Watanabe M, Higashiyama A, Ono Y, Miyamoto Y, et al. The combined impact of blood pressure category and glucose abnormality on the incidence of cardiovascular diseases in a Japanese urban cohort: the Suita Study. Hypertens Res 2010;33(12):1238-43.",Tomiwa,7,0,NA,0,5.6-6.9 mmol/L,0,0,1,1,1,0,0,Suita study,Japan ,2010,1989-1994,11.7,1,"Age, BMI, hypertension, hyperlipidemia, smoking and drinking status",5069,2737,54.28112054,53.56265985,55.12435678,NA,NA,NA,NA,NA,NA,NA,NA,NA,NA,NA,NA,NA,0,NA,NA,,NA,NA,NA,NA,NA,NA,NA,NA,NA,NA,NA,NA,NA,NA,69,28,1.36,0.84,2.19,0.97,0.64,1.46,NA,NA,NA,NA,NA,NA,NA,NA,NA,NA,NA,NA,NA,NA,NA,NA,CVD was defined as stroke or CHD,139,48,1.49,1.02,2.16,1.13,0.85,1.51,"The criteria for a diagnosis of CHD included first ever acute myocardial infarction, sudden cardiac death within 24 h after the onset of acute illness or coronary artery disease followed by coronary artery bypass surgery or angioplasty",70,20,1.83,1.01,3.32,1.31,0.87,1.96,NA,NA,NA,NA,NA,NA,NA,NA,NA,NA,NA,NA,NA,NA,NA,NA,NA
"Magliano et al., 2010","50. Magliano DJ, Soderberg S, Zimmet PZ, Cartensen B, Balkau B, Pauvaday V, et al. Mortality, all-cause and cardiovascular disease, over 15 years in multiethnic mauritius: impact of diabetes and intermediate forms of glucose tolerance. Diabetes Care 2010;33(9):1983-9.",Tyler,8,1,NA,1,6.1-6.9 mmol/L,1,1,0,0,0,0,0,NA,Mauritius,2010,1987-2007,15.1,1,"Waist/hip circumference, smoking, hypertension, ethnicity, prior CVD, education, HDL cholesterol, triglycerides, total cholesterol",8793,4623,NA,NA,NA,0,NA,NA,NA,NA,NA,NA,NA,NA,NA,NA,NA,NA,0,NA,NA,,0.9,0.56,1.45,1.13,0.82,1.56,NA,NA,0.66,0.32,1.38,1.24,0.82,1.87,NA,NA,NA,NA,NA,NA,NA,NA,NA,NA,NA,NA,NA,NA,NA,NA,NA,NA,NA,NA,NA,NA,NA,NA,"We defined CVD mortality to include deaths categorized as cardiac, cerebrovascular, hypertension, and renal failure as the primary cuase of death. ",NA,NA,NA,NA,NA,NA,NA,NA,NA,NA,NA,NA,NA,NA,NA,NA,NA,NA,NA,NA,NA,NA,NA,NA,NA,NA,NA,NA,NA,NA,NA,NA,NA,NA
"Magliano et al., 2010","50. Magliano DJ, Soderberg S, Zimmet PZ, Cartensen B, Balkau B, Pauvaday V, et al. Mortality, all-cause and cardiovascular disease, over 15 years in multiethnic mauritius: impact of diabetes and intermediate forms of glucose tolerance. Diabetes Care 2010;33(9):1983-9.",Tyler,8,2,NA,1,7.8 - 11.1 mmol/L,1,1,0,0,0,0,0,NA,Mauritius,2010,1987-2007,15.1,1,"Waist/hip circumference, smoking, hypertension, ethnicity, prior CVD, education, HDL cholesterol, triglycerides, total cholesterol",8793,4623,NA,NA,NA,0,NA,NA,NA,NA,NA,NA,NA,NA,NA,NA,NA,NA,0,NA,NA,,1.21,0.96,1.53,1.39,1.12,1.71,NA,NA,1.16,0.84,1.59,1.37,1.02,1.83,NA,NA,NA,NA,NA,NA,NA,NA,NA,NA,NA,NA,NA,NA,NA,NA,NA,NA,NA,NA,NA,NA,NA,NA,"We defined CVD mortality to include deaths categorized as cardiac, cerebrovascular, hypertension, and renal failure as the primary cuase of death. ",NA,NA,NA,NA,NA,NA,NA,NA,NA,NA,NA,NA,NA,NA,NA,NA,NA,NA,NA,NA,NA,NA,NA,NA,NA,NA,NA,NA,NA,NA,NA,NA,NA,NA
"Madssen et al., 2012","58. Madssen E, Vatten L, Nilsen TI, Midthjell K, Wiseth R, Dale AC. Abnormal glucose regulation and gender-specific risk of fatal coronary artery disease in the HUNT 1 study. Scand Cardiovasc J 2012;46(4):219-25.",Kuralay,9,5,WHO FPG + OGTT 2hPG ,1,PreDM,1,1,0,0,0,0,0,HUNT 1,Norway,2012,1984-2003,18,1,"Age, BMI, hypertension, established cardiovascular disease, smoking habits, exercise sessions per week",45530,23381,59.49654733,59.87167358,59.10055533,0,NA,NA,NA,NA,NA,NA,9.66,11.87017924,7.568260553,NA,NA,NA,0,NA,NA,,1.3,NA,1.04,1.6,1.04,1.2,66,20,1.2,0.8,1.9,1.2,0.9,1.6,NA,NA,NA,NA,NA,NA,NA,NA,NA,NA,NA,NA,NA,NA,NA,NA,NA,NA,NA,NA,NA,NA,NA,NA,NA,NA,NA,NA,NA,NA,NA,NA,NA,NA,NA,NA,NA,NA,NA,NA,NA,NA,NA,NA,NA,NA,NA,NA,NA,NA,NA,NA,NA,NA,NA,NA,NA,NA,NA
"Gordon-Dseagu et al., 2015","68. Gordon-Dseagu VL, Mindell JS, Steptoe A, Moody A, Wardle J, Demakakos P, et al. Impaired glucose metabolism among those with and without diagnosed diabetes and mortality: a cohort study using Health Survey for England data. PLoS One 2015;10(3):e0119882.",Modupe,10,3,NA,0,5.7-<6.5% (39-<48 mmol/mol),1,1,0,0,0,0,0,HSE,UK,2015,2003-2008,7,1,"Age, sex, smoking status, SES, BMI",20674,NA,NA,NA,NA,0,NA,NA,NA,NA,NA,NA,NA,NA,NA,NA,NA,NA,0,NA,NA,,0.99,0.83,1.18,0.92,0.77,1.09,NA,NA,NA,NA,NA,NA,NA,NA,NA,NA,NA,NA,NA,NA,NA,NA,NA,NA,NA,NA,NA,NA,NA,NA,NA,NA,NA,NA,NA,NA,NA,NA,,NA,NA,1.06,0.76,1.46,1.08,0.81,1.45,,NA,NA,NA,NA,NA,NA,NA,NA,NA,NA,NA,NA,NA,NA,NA,NA,NA,NA,NA,NA,NA,NA,NA,NA,NA
"Hadaegh et al., 2015","69. Hadaegh F, Ehteshami-Afshar S, Hajebrahimi MA, Hajsheikholeslami F, Azizi F. Silent coronary artery disease and incidence of cardiovascular and mortality events at different levels of glucose regulation; results of greater than a decade follow-up. Int J Cardiol 2015;182:334-9.",Fatima,11,5,ADA FPG + OGTT 2hPG ,1,PreDM,1,0,1,1,0,0,0,TLGS,Iran,2015,1999-2012,12.1,1,"Age, hypertension, hypercholesterolemia, BMI, smoking",1538,815,59.51252276,58.55920245,60.58715076,0,5.15130039,5.158834356,5.16,NA,NA,NA,NA,NA,NA,NA,NA,NA,0,58,25,,1.35,0.78,2.3,0.99,0.64,1.55,NA,NA,NA,NA,NA,NA,NA,NA,NA,NA,NA,NA,NA,NA,NA,NA,NA,NA,NA,NA,NA,NA,NA,NA,NA,NA,NA,NA,NA,NA,NA,NA,"composite measure of any CHD events, stroke, or cerebrovascular events",120,60,1.67,1.16,2.41,0.863,0.63,1.29,"Cases of definite MI diagnosed by ECG and biomarkers, probable MI, unstable angina pectoris, and angiographic proven CHD.",102,54,1.8,1.21,2.68,0.83,0.58,1.18,NA,NA,NA,NA,NA,NA,NA,NA,NA,NA,NA,NA,NA,NA,NA,NA,NA
"Warren et al., 2017","82. Warren B, Pankow JS, Matsushita K, Punjabi NM, Daya NR, Grams M, et al. Comparative prognostic performance of definitions of prediabetes: a prospective cohort analysis of the Atherosclerosis Risk in Communities (ARIC) study. Lancet Diabetes Endocrinol 2017;5(1):34-42.",Tomiwa,12,2,NA,1,7.8 - 11.0 mmol/L,1,0,1,0,0,0,0,ARIC,USA,2017,1987-2013,NA,1,"Adjusted for age, sex (male, female), race-center (white, Minneapolis, MN; black, Jackson, MS; white, Washington County, MD; black, Forsyth County, NC; white, Forsyth County, NC), education level (less than high school, high school or equivalent, college or above), BMI, waist-to-hip ratio, total cholesterol, HDL, triglycerides, hypertension (yes, no), eGFR, smoking status (current, former, never), drinking status (current, former, never), lipid-lowering medication use (yes, no), family history of diabetes (yes, no)school, high school or equivalent, college or above), BMI, waist-to-hip ratio, total cholesterol, HDL, triglycerides, hypertension , eGFR, smoking status (current, former, never), drinking status (current, former,
never), lipid-lowering medication use  family history of diabetes ",6451,3718,62.56713688,NA,NA,0,5.347198884,NA,NA,NA,NA,NA,NA,NA,NA,88.22456983,NA,NA,0,491,NA,,1.08,0.91,1.28,1.27,1.09,1.5,NA,NA,NA,NA,NA,NA,NA,NA,NA,NA,NA,NA,NA,NA,NA,NA,NA,NA,NA,NA,NA,NA,NA,NA,NA,NA,NA,NA,NA,NA,NA,NA,"Incident atherosclerotic cardiovascular disease events were adjudicated and included any coronary heart disease hospital admission or death, or ischaemic stroke hospital admission or death, and were obtained by continuous active surveillance",217,NA,0.91,0.71,1.18,1.03,0.81,1.29,NA,NA,NA,NA,NA,NA,NA,NA,NA,Glomerular filtration rate (eGFR) of <60ml/min per 1.73 m2 measured at a study visit and a reduction in eGFR of at least 25% from the baseline visit to the follow up visit ,429,NA,1.11,0.94,1.32,1.04,0.86,1.25,NA,NA,NA,NA,NA,NA,NA,NA
"Warren et al., 2017","82. Warren B, Pankow JS, Matsushita K, Punjabi NM, Daya NR, Grams M, et al. Comparative prognostic performance of definitions of prediabetes: a prospective cohort analysis of the Atherosclerosis Risk in Communities (ARIC) study. Lancet Diabetes Endocrinol 2017;5(1):34-42.",Tomiwa,12,0,NA,1,5.6-6.9 mmol/L,1,0,1,0,0,0,0,ARIC,USA,2017,1987-2013,NA,1,"Adjusted for age, sex (male, female), race-center (white, Minneapolis, MN; black, Jackson, MS; white, Washington County, MD; black, Forsyth County, NC; white, Forsyth County, NC), education level (less than high school, high school or equivalent, college or above), BMI, waist-to-hip ratio, total cholesterol, HDL, triglycerides, hypertension (yes, no), eGFR, smoking status (current, former, never), drinking status (current, former, never), lipid-lowering medication use (yes, no), family history of diabetes (yes, no)school, high school or equivalent, college or above), BMI, waist-to-hip ratio, total cholesterol, HDL, triglycerides, hypertension , eGFR, smoking status (current, former, never), drinking status (current, former,
never), lipid-lowering medication use  family history of diabetes ",6862,4007,62.76243078,NA,NA,0,5.374060041,NA,NA,NA,NA,NA,NA,NA,NA,88.23121539,NA,NA,0,523,NA,,1.27,1.08,1.51,1.01,0.87,1.17,NA,NA,NA,NA,NA,NA,NA,NA,NA,NA,NA,NA,NA,NA,NA,NA,NA,NA,NA,NA,NA,NA,NA,NA,NA,NA,NA,NA,NA,NA,NA,NA,"Incident atherosclerotic cardiovascular disease events were adjudicated and included any coronary heart disease hospital admission or death, or ischaemic stroke hospital admission or death, and were obtained by continuous active surveillance",269,NA,1.17,0.91,1.5,1.06,0.86,1.31,NA,NA,NA,NA,NA,NA,NA,NA,NA,Glomerular filtration rate (eGFR) of <60ml/min per 1.73 m2 measured at a study visit and a reduction in eGFR of at least 25% from the baseline visit to the follow up visit ,453,NA,0.97,0.82,1.15,0.87,0.74,1.03,NA,NA,NA,NA,NA,NA,NA,NA
"Ahn et al., 2018","83. Ahn SV, Kim HC, Nam CM, Suh I. Sex difference in the effect of the fasting serum glucose level on the risk of coronary heart disease. J Cardiol 2018;71(2):149-154.",Kuralay,13,0,NA,0,100-109 mg/dL,0,0,0,1,0,0,0,KMIC,South Korea,2018,1990-2003,11,1,"Age, BMI, blood pressure, total cholesterol level, cigarette smoking status",155924,59077,43.84701136,42.35622831,44.75639411,1,88.15237167,85.43012509,89.81,NA,NA,NA,NA,NA,NA,NA,NA,NA,0,NA,NA,,NA,NA,NA,NA,NA,NA,NA,NA,NA,NA,NA,NA,NA,NA,NA,NA,NA,NA,NA,NA,NA,NA,NA,NA,NA,NA,NA,NA,NA,NA,NA,NA,NA,NA,NA,NA,NA,NA,NA,NA,NA,NA,NA,NA,NA,NA,NA,"Defined by ICD-10 codes 120-125: angina, pectoris, acute myocardial infarction (MI), subsequent acute MI, other acute ischemic heart disease, and chronic ischemic heart disease",366,49,1.17,0.9,1.52,1,0.9,1.12,NA,NA,NA,NA,NA,NA,NA,NA,NA,NA,NA,NA,NA,NA,NA,NA,NA
"Ahn et al., 2018","83. Ahn SV, Kim HC, Nam CM, Suh I. Sex difference in the effect of the fasting serum glucose level on the risk of coronary heart disease. J Cardiol 2018;71(2):149-154.",,13,0,NA,0,110-125 mg/dL,0,0,0,1,0,0,0,KMIC,South Korea,2018,1990-2003,11,1,"Age, BMI, blood pressure, total cholesterol level, cigarette smoking status",155924,59077,43.84701136,42.35622831,44.75639411,1,88.15237167,85.43012509,89.81,NA,NA,NA,NA,NA,NA,NA,NA,NA,0,NA,NA,,NA,NA,NA,NA,NA,NA,NA,NA,NA,NA,NA,NA,NA,NA,NA,NA,NA,NA,NA,NA,NA,NA,NA,NA,NA,NA,NA,NA,NA,NA,NA,NA,NA,NA,NA,NA,NA,NA,NA,NA,NA,NA,NA,NA,NA,NA,NA,"Defined by ICD-10 codes 120-125: angina, pectoris, acute myocardial infarction (MI), subsequent acute MI, other acute ischemic heart disease, and chronic ischemic heart disease",180,19,1.62,1.11,2.36,1.07,0.92,1.25,NA,NA,NA,NA,NA,NA,NA,NA,NA,NA,NA,NA,NA,NA,NA,NA,NA
"Ares et al., 2019","86. Ares J, Valdes S, Botas P, Sanchez-Ragnarsson C, Rodriguez-Rodero S, Morales-Sanchez P, et al. Mortality risk in adults according to categories of impaired glucose metabolism after 18 years of follow-up in the North of Spain: The Asturias Study. PLoS One 2019;14(1):e0211070.",Kuralay,14,2,NA,1,7.8-11.0 mmol/L,1,1,0,0,0,0,,Asturias Study,Spain,2019,1998-1999,18,1,"Age, sex, BMI, history of high BP, smoking habits, LDL-C, glomerular filtration rate, and the prior presence of cardiovascular disease",903,505,51.72735327,NA,NA,1,94.51694352,NA,NA,5.09833887,NA,NA,3.433001107,NA,NA,79.98593577,NA,NA,0,62,NA,,0.96,0.56,1.62,0.89,0.55,1.41,74,39,1.04,0.44,2.5,1.35,0.58,3.15,NA,NA,NA,NA,NA,NA,NA,NA,NA,NA,NA,NA,NA,NA,NA,NA,NA,NA,NA,NA,NA,NA,NA,NA,NA,NA,NA,NA,NA,NA,NA,NA,NA,NA,NA,NA,NA,NA,NA,NA,NA,NA,NA,NA,NA,NA,NA,NA,NA,NA,NA,NA,NA,NA,NA,NA,NA,NA,NA
"Parizadeh et al., 2019","90. Parizadeh D, Rahimian N, Akbarpour S, Azizi F, Hadaegh F. Sex-specific clinical outcomes of impaired glucose status: A long follow-up from the Tehran Lipid and Glucose Study. Eur J Prev Cardiol 2019;26(10):1080-1091.",Ayo,15,0,NA,1,5.6-6.9 mmol/L,1,0,0,1,1,0,1,TLGS,Iran,2019,1999-2005,12,1,"age, body mass index, education level, waist/hip ratio, total cholesterol, high-density lipoprotein cholesterol, triglycerides, estimated glomerular filtration rate, smoking, lipid-lowering drug, prevalent cardiovascular disease; additional adjustments were ahypertension, family history of diabetes;",3198,NA,NA,NA,NA,,NA,NA,NA,NA,NA,NA,NA,NA,NA,NA,NA,NA,0,,,,1.26,0.83,1.9,1.18,0.88,1.64,NA,NA,NA,NA,NA,NA,NA,NA,124,54,0.61,0.28,1.27,1.31,0.72,2.38,NA,NA,NA,NA,NA,NA,NA,NA,NA,NA,NA,NA,NA,NA,NA,NA,NA,NA,NA,NA,NA,NA,NA,NA,NA,,586,215,1.57,1.14,2.16,0.98,0.73,1.31,,1140,758,0.83,0.67,1.02,1.11,0.83,1.5,NA,NA,NA,NA,NA,NA,NA,NA
"Rhee et al., 2020","95. Rhee EJ, Jung I, Kwon H, et al. Increased Mortality Burden in Young Asian Subjects with Dysglycemia and Comorbidities. J Clin Med. 2020;9: pii: E1042.",Tyler,16,0,NA,0,100-125 mg/dL,1,0,0,0,0,0,0,NHIS (KNHS),South Korea,2020,2009-2016,7.3,1,"age, sex, current smoking, alcohol drinking, regular exercise, body mass index, hypertension, dyslipidemia and chronic kidney disease","5,617,468","2,473,828",47,NA,NA,1,NA,NA,NA,NA,NA,NA,2.80%,NA,NA,NA,NA,NA,0,52650,17024,,1.061,1.042,1.081,1.044,1.031,1.058,NA,NA,NA,NA,NA,NA,NA,NA,NA,NA,NA,NA,NA,NA,NA,NA,NA,NA,NA,NA,NA,NA,NA,NA,NA,NA,NA,NA,NA,NA,NA,NA,NA,NA,NA,NA,NA,NA,NA,NA,NA,NA,NA,NA,NA,NA,NA,NA,NA,NA,NA,NA,NA,NA,NA,NA,NA,NA,NA,NA,NA,NA,NA,NA,NA,NA,NA
"Onat et al., 2013","62. Onat A, Can G, Cicek G, Ayhan E, Dogan Y, Kaya H. Fasting, non-fasting glucose and HDL dysfunction in risk of pre-diabetes, diabetes, and coronary disease in non-diabetic adults. Acta Diabetol 2013;50(4):519-28.",James,17,1,NA,1,6.1-7.0 mmol/L,0,0,0,1,0,0,0,TARF,Turkey,2011,1997-2010,7.24,1,"sex, age and glucose categories for incident type-2 diabetes, in non-diabetic sample at baseline, in two models",2619,1343,47.84360443,47.6,48.1,mmol/L,5.310576556,5.5,5.4,NA,NA,NA,NA,NA,NA,NA,NA,NA,1,NA,NA,,NA,NA,NA,NA,NA,NA,NA,NA,NA,NA,NA,NA,NA,NA,NA,NA,NA,NA,NA,NA,NA,NA,NA,NA,NA,NA,NA,NA,NA,NA,NA,NA,NA,NA,NA,NA,NA,NA,NA,NA,NA,NA,NA,NA,NA,NA,NA,"based on the presence of angina pectoris, of a history of myocardial infarction with or without accompanying Minnesota codes of the ECG [24] or on a history of myocardial revascularization.",294,142,1.15,0.55,2.41,0.78,0.34,1.82,NA,NA,NA,NA,NA,NA,NA,NA,NA,NA,NA,NA,NA,NA,NA,NA,NA
