"Onat et al., 2013","62. Onat A, Can G, Cicek G, Ayhan E, Dogan Y, Kaya H. Fasting, non-fasting glucose and HDL dysfunction in risk of pre-diabetes, diabetes, and coronary disease in non-diabetic adults. Acta Diabetol 2013;50(4):519-28.",James,17,2,NA,1,7.8-11.1 mmolL,0,0,0,1,0,0,0,TARF,Turkey,2011,1997-2010,7.24,1,"sex, age and glucose categories for incident type-2 diabetes, in non-diabetic sample at baseline, in two models",2619,1343,47.84360443,47.6,48.1,mmol/L,5.310576556,5.5,5.4,NA,NA,NA,NA,NA,NA,NA,NA,NA,1,NA,NA,,NA,NA,NA,NA,NA,NA,NA,NA,NA,NA,NA,NA,NA,NA,NA,NA,NA,NA,NA,NA,NA,NA,NA,NA,NA,NA,NA,NA,NA,NA,NA,NA,NA,NA,NA,NA,NA,NA,NA,NA,NA,NA,NA,NA,NA,NA,NA,"based on the presence of angina pectoris, of a history of myocardial infarction with or without accompanying Minnesota codes of the ECG [24] or on a history of myocardial revascularization.",294,142,3.74,1.16,12,1.86,0.69,5.05,NA,NA,NA,NA,NA,NA,NA,NA,NA,NA,NA,NA,NA,NA,NA,NA,NA
"Kim et al., 2013","60. Kim HK, Kim CH, Kim EH, Bae SJ, Choe J, Park JY, et al. Impaired fasting glucose and risk of cardiovascular disease in Korean men and women: the Korean Heart Study. Diabetes Care 2013;36(2):328-35.",James,18,0,NA,0,100-109 mg/dL,0,0,1,1,1,0,0,Korean Heart Study,South Korea,2013,1996-2004,10,1,"age, systolic blood pressure, antihypertensive medication, LDL cholesterol, HDL cholesterol, current smoking, BMI, and family history of CVD.","357,407",140651.667,45.39060763,NA,NA,1,90.75195813,NA,NA,NA,NA,NA,NA,NA,NA,NA,NA,NA,0,NA,NA,,NA,NA,NA,NA,NA,NA,NA,NA,NA,NA,NA,NA,NA,NA,954,352,NA,NA,NA,NA,NA,NA,648,238,1,0.87,1.16,1.03,0.92,1.16,306,114,1.06,0.86,1.3,1.05,0.89,1.23,NA,5107,1898,0.96,0.89,1.04,1.1,1.05,1.17,NA,1712,526,1.09,0.99,1.2,1.06,0.99,1.13,NA,NA,NA,NA,NA,NA,NA,NA,NA,NA,NA,NA,NA,NA,NA,NA,NA
"Kim et al., 2013","60. Kim HK, Kim CH, Kim EH, Bae SJ, Choe J, Park JY, et al. Impaired fasting glucose and risk of cardiovascular disease in Korean men and women: the Korean Heart Study. Diabetes Care 2013;36(2):328-35.",James,18,0,NA,0,110-125 mg/dL,0,0,1,1,1,0,0,Korean Heart Study,South Korea,2013,1996-2004,10,1,"age, systolic blood pressure, antihypertensive medication, LDL cholesterol, HDL cholesterol, current smoking, BMI, and family history of CVD.","357,407",140651.667,45.39060763,NA,NA,1,90.75195813,NA,NA,NA,NA,NA,NA,NA,NA,NA,NA,NA,0,NA,NA,,NA,NA,NA,NA,NA,NA,NA,NA,NA,NA,NA,NA,NA,NA,482,145,NA,NA,NA,NA,NA,NA,347,109,1.07,0.88,1.31,1.24,1.08,1.43,135,36,0.82,0.59,1.16,1.17,0.94,1.45,NA,2360,749,0.96,0.89,1.04,1.1,1.05,1.17,NA,801,197,0.97,0.84,1.13,1.18,1.08,1.29,NA,NA,NA,NA,NA,NA,NA,NA,NA,NA,NA,NA,NA,NA,NA,NA,NA
"Donahue et al., 2011","10. Donahue RP, Dorn JM, Stranges S, Swanson M, Hovey K, Trevisan M. Impaired fasting glucose and recurrent cardiovascular disease among survivors of a first acute myocardial infarction: evidence of a sex difference? The Western New York experience. Nutr Metab Cardiovasc Dis 2011;21(7):504-11.",James,19,0,NA,0,100-125 mg/dL,0,0,0,1,1,0,0,Western New York Acute MI Study,USA,2011,1996-2004,4.5,1,"Adjusted for age, current smoker (yes vs. otherwise), Ever use alcohol (yes vs. otherwise), hypertension(yes vs. otherwise), hypercholesterolemia (yes vs. otherwise), aspirin use (yes vs. otherwise), BMI (continuous).",1226,348,55.08466558,56.44827586,54.54419134,1,110.3620718,116.1508621,108.07,NA,NA,NA,NA,NA,NA,NA,NA,NA,0,NA,NA,,NA,NA,NA,NA,NA,NA,NA,NA,NA,NA,NA,NA,NA,NA,NA,NA,NA,NA,NA,NA,NA,NA,NA,NA,NA,NA,NA,NA,NA,NA,NA,NA,NA,NA,NA,NA,NA,NA,NA,264,91,2.24,1.2,4.18,0.83,0.57,1.21,NA,NA,NA,NA,NA,NA,NA,NA,NA,NA,NA,NA,NA,NA,NA,NA,NA,NA,NA,NA,NA,NA,NA,NA,NA,NA
"Kim et al., 2016","Association of prediabetes, defined by fasting glucose, HbA1c only, or combined criteria, with the risk of cardiovascular disease in Koreans Hong-Kyu KIM,1 Jung Bok LEE,2 Seon Ha KIM,3 Min-Woo JO,3 Eun Hee KIM,1 Jenie Yoonoo HWANG,1 Sung Jin BAE,1 Chang Hee JUNG,4 Woo Je LEE,4 Joong-Yeol PARK,4 Gyung-Min PARK,5 Young-Hak KIM5 and Jaewon CHOE1",James,20,0,NA,1,100-125 mg/dL,0,0,1,1,0,0,0,NA,South Korea,2015,2007-2011,3.1,1,"MV-adjusted HRs were adjusted for age, sex, hypertension, low-density lipoprotein cholesterol, high-density lipoprotein cholesterol, smoking, a family history of CVD, and body mass index.",76434,32685,47.5,NA,NA,0,5.48,NA,NA,5.5,NA,NA,NA,NA,NA,NA,NA,NA,0,88,NA,,NA,NA,NA,NA,NA,NA,NA,NA,NA,NA,NA,NA,NA,NA,105,NA,NA,NA,NA,NA,NA,NA,NA,NA,NA,NA,NA,NA,NA,NA,NA,NA,NA,NA,NA,NA,NA,NA,"were also defined as a composite of cardiovascular death, MI, stroke (hemorrhagic and ischemic), coronary revascularization, and hospitalization with IHD",222,NA,1.39,0.95,2.04,0.95,0.75,1.22,"Cardiovascular death, MI, revascularization, and hospitalization with IHD were classified as major IHD events",120,NA,1.97,0.97,3.99,0.92,0.71,1.21,NA,NA,NA,NA,NA,NA,NA,NA,NA,NA,NA,NA,NA,NA,NA,NA,NA
"Kim et al., 2016","Association of prediabetes, defined by fasting glucose, HbA1c only, or combined criteria, with the risk of cardiovascular disease in Koreans Hong-Kyu KIM,1 Jung Bok LEE,2 Seon Ha KIM,3 Min-Woo JO,3 Eun Hee KIM,1 Jenie Yoonoo HWANG,1 Sung Jin BAE,1 Chang Hee JUNG,4 Woo Je LEE,4 Joong-Yeol PARK,4 Gyung-Min PARK,5 Young-Hak KIM5 and Jaewon CHOE1",James,20,3,NA,1,5.7%-6.4%,0,0,1,1,0,0,0,NA,South Korea,2015,2007-2011,3.1,1,"MV-adjusted HRs were adjusted for age, sex, hypertension, low-density lipoprotein cholesterol, high-density lipoprotein cholesterol, smoking, a family history of CVD, and body mass index.",76434,32685,47.5,NA,NA,0,5.48,NA,NA,5.5,NA,NA,NA,NA,NA,NA,NA,NA,0,65,NA,,NA,NA,NA,NA,NA,NA,NA,NA,NA,NA,NA,NA,NA,NA,85,NA,NA,NA,NA,NA,NA,NA,NA,NA,NA,NA,NA,NA,NA,NA,NA,NA,NA,NA,NA,NA,NA,NA,"were also defined as a composite of cardiovascular death, MI, stroke (hemorrhagic and ischemic), coronary revascularization, and hospitalization with IHD",191,NA,1.18,0.79,1.77,1.22,0.94,1.59,"Cardiovascular death, MI, revascularization, and hospitalization with IHD were classified as major IHD events",112,NA,2.27,1.1,4.7,1.54,1.17,2.03,NA,NA,NA,NA,NA,NA,NA,NA,NA,NA,NA,NA,NA,NA,NA,NA,NA
"Kim et al., 2016","Association of prediabetes, defined by fasting glucose, HbA1c only, or combined criteria, with the risk of cardiovascular disease in Koreans Hong-Kyu KIM,1 Jung Bok LEE,2 Seon Ha KIM,3 Min-Woo JO,3 Eun Hee KIM,1 Jenie Yoonoo HWANG,1 Sung Jin BAE,1 Chang Hee JUNG,4 Woo Je LEE,4 Joong-Yeol PARK,4 Gyung-Min PARK,5 Young-Hak KIM5 and Jaewon CHOE1",James,20,5,ADA FPG + ADA HbA1c,1,100-125 mg/dL OR 5.7%-6.4%,0,0,1,1,0,0,0,NA,South Korea,2015,2007-2011,3.1,1,"MV-adjusted HRs were adjusted for age, sex, hypertension, low-density lipoprotein cholesterol, high-density lipoprotein cholesterol, smoking, a family history of CVD, and body mass index.",76434,32685,47.5,NA,NA,0,5.48,NA,NA,5.5,NA,NA,NA,NA,NA,NA,NA,NA,0,113,NA,,NA,NA,NA,NA,NA,NA,NA,NA,NA,NA,NA,NA,NA,NA,194,NA,NA,NA,NA,NA,NA,NA,NA,NA,NA,NA,NA,NA,NA,NA,NA,NA,NA,NA,NA,NA,NA,NA,"were also defined as a composite of cardiovascular death, MI, stroke (hemorrhagic and ischemic), coronary revascularization, and hospitalization with IHD",,NA,1.48,1.02,2.16,1.99,0.78,1.26,"Cardiovascular death, MI, revascularization, and hospitalization with IHD were classified as major IHD events",168,NA,3.01,1.36,6.68,1.17,0.89,1.52,NA,NA,NA,NA,NA,NA,NA,NA,NA,NA,NA,NA,NA,NA,NA,NA,NA
"Huang et al., 2020","Huang YQ, Liu L, Huang JY, Chen CL, Yu YL, Lo K, Feng YQ. Prediabetes and risk for all-cause and cardiovascular mortality based on hypertension status. Ann Transl Med 2020;8(23):1580. doi: 10.21037/atm-20-1155",James,21,5,ADA FPG + ADA HbA1c,1,PreDM(+) & HTN(+),1,1,0,0,0,0,0,1999-2014 NHANES,China,2020,1994-2014,8.4,1,"Adjusted for age, gender, smoking, education, race, body mass index, cardiovascular disease at baseline, cancer at baseline, total cholesterol, high-density-lipoprotein cholesterol, energy intake, estimated glomerular filtration rate, the use of statin, antiplatelet drugs. CVD, cardiovascular disease; DM, diabetes mellitus; HTN, hypertension; HDL-C, high-density lipoprotein cholesterol; HR, hazard ratio; CI, confidence interval.",34047,17613,44.6,NA,NA,1,NA,NA,NA,NA,NA,NA,7.4,NA,NA,92.1,NA,NA,0,1115,480,,1.29,1.07,1.56,1.41,1.21,1.63,227,89,2.28,1.24,4.2,1.96,1.32,2.9,NA,NA,NA,NA,NA,NA,NA,NA,NA,NA,NA,NA,NA,NA,NA,NA,NA,NA,NA,NA,NA,NA,NA,NA,NA,NA,NA,NA,NA,NA,NA,NA,NA,NA,NA,NA,NA,NA,NA,NA,NA,NA,NA,NA,NA,NA,NA,NA,NA,NA,NA,NA,NA,NA,NA,NA,NA,NA,NA
"Huang et al., 2020","Huang YQ, Liu L, Huang JY, Chen CL, Yu YL, Lo K, Feng YQ. Prediabetes and risk for all-cause and cardiovascular mortality based on hypertension status. Ann Transl Med 2020;8(23):1580. doi: 10.21037/atm-20-1155",James,21,5,ADA FPG + ADA HbA1c,1,PreDM(+) & HTN(-),1,1,0,0,0,0,0,1999-2014 NHANES,China,2020,1994-2014,8.4,1,"Adjusted for age, gender, smoking, education, race, body mass index, cardiovascular disease at baseline, cancer at baseline, total cholesterol, high-density-lipoprotein cholesterol, energy intake, estimated glomerular filtration rate, the use of statin, antiplatelet drugs. CVD, cardiovascular disease; DM, diabetes mellitus; HTN, hypertension; HDL-C, high-density lipoprotein cholesterol; HR, hazard ratio; CI, confidence interval.",34047,17613,44.6,NA,NA,1,NA,NA,NA,NA,NA,NA,7.4,NA,NA,92.1,NA,NA,0,405,133,,1.1,0.87,1.38,1.02,0.87,1.21,47,15,1.66,0.8,3.46,1.66,0.8,3.46,NA,NA,NA,NA,NA,NA,NA,NA,NA,NA,NA,NA,NA,NA,NA,NA,NA,NA,NA,NA,NA,NA,NA,NA,NA,NA,NA,NA,NA,NA,NA,NA,NA,NA,NA,NA,NA,NA,NA,NA,NA,NA,NA,NA,NA,NA,NA,NA,NA,NA,NA,NA,NA,NA,NA,NA,NA,NA,NA
"Schottker et al., 2013",DOI 10.1007/s00125-012-2707-x,James,22,0,NA,1,100-125 mg/dL,0,0,1,0,0,0,0,ESTHER,Germany,2013,2000-2002,7.9,1,"a Adjusted for age, sex, systolic blood pressure, current smoking and total cholesterol/HDL-cholesterol ratio IR, incidence rate per 1,000 person-years; PY, person-years at risk;",9949,5210,62,NA,NA,0,NA,NA,NA,NA,NA,NA,NA,NA,NA,NA,NA,NA,0,NA,NA,,NA,NA,NA,NA,NA,NA,NA,NA,NA,NA,NA,NA,NA,NA,NA,NA,NA,NA,NA,NA,NA,NA,NA,NA,NA,NA,NA,NA,NA,NA,NA,NA,NA,NA,NA,NA,NA,NA,"We defined a composite endpoint of CVE of myocardial infarction, stroke or cardiovascular death.",104,39,0.99,0.7,1.41,1.18,0.88,1.58,NA,NA,NA,NA,NA,NA,NA,NA,NA,NA,NA,NA,NA,NA,NA,NA,NA,NA,NA,NA,NA,NA,NA,NA,NA,NA
"Schottker et al., 2013",DOI 10.1007/s00125-012-2707-x,James,22,3,NA,1,"5.7%-6,4%",0,0,1,0,0,0,0,ESTHER,Germany,2013,2000-2002,7.9,1,"a Adjusted for age, sex, systolic blood pressure, current smoking and total cholesterol/HDL-cholesterol ratio IR, incidence rate per 1,000 person-years; PY, person-years at risk;",9949,5210,62,NA,NA,0,NA,NA,NA,NA,NA,NA,NA,NA,NA,NA,NA,NA,0,NA,NA,,NA,NA,NA,NA,NA,NA,NA,NA,NA,NA,NA,NA,NA,NA,NA,NA,NA,NA,NA,NA,NA,NA,NA,NA,NA,NA,NA,NA,NA,NA,NA,NA,NA,NA,NA,NA,NA,NA,"We defined a composite endpoint of CVE of myocardial infarction, stroke or cardiovascular death.",207,97,0.96,0.73,1.25,1.09,0.86,1.39,NA,NA,NA,NA,NA,NA,NA,NA,NA,NA,NA,NA,NA,NA,NA,NA,NA,NA,NA,NA,NA,NA,NA,NA,NA,NA
"Sinha et al., 2023",https://doi.org/10.1016/j.cardfail.2022.10.426,James,23,0,NA,0,White,0,0,1,0,0,1,0,Lifetime Risk Pooling Project,USA,2023,NA,19.74464267,1,"Adjusted for age, education, body mass index, hypertension, hyperlipidemia, and smoking.",19170,10621,49.55299948,49.53629602,49.57375132,1,NA,NA,NA,NA,NA,NA,NA,NA,NA,NA,NA,NA,0,NA,NA,,NA,NA,NA,NA,NA,NA,NA,NA,NA,NA,NA,NA,NA,NA,NA,NA,NA,NA,NA,NA,NA,NA,NA,NA,NA,NA,NA,NA,NA,NA,NA,NA,NA,NA,NA,NA,NA,NA,"fatal and nonfatal MI was adjudicated using standardized clinical criteria that consisted of at least 2 of the following: electrocardiographic changes consistent with MI, biomarker elevations consistent with myocardial damage, and/or typical chest pain or International Classification of Diseases (ICD) codes (ICD-9 codes 410414 or equivalent).2",NA,NA,1.33,1.08,1.63,1.21,1.05,1.41,NA,NA,NA,NA,NA,NA,NA,NA,NA,NA,NA,NA,NA,NA,NA,NA,NA,NA,NA,NA,1.2,0.93,1.54,1.38,1.09,1.75
"Sinha et al., 2023",https://doi.org/10.1016/j.cardfail.2022.10.426,James,23,0,NA,0,Black,0,0,1,0,0,1,0,Lifetime Risk Pooling Project,USA,2023,NA,19.74464267,1,"Adjusted for age, education, body mass index, hypertension, hyperlipidemia, and smoking.",19170,10621,49.55299948,49.53629602,49.57375132,1,NA,NA,NA,NA,NA,NA,NA,NA,NA,NA,NA,NA,0,NA,NA,,NA,NA,NA,NA,NA,NA,NA,NA,1.56,0.52,4.71,NA,NA,NA,NA,NA,NA,NA,NA,NA,NA,NA,NA,NA,NA,NA,NA,NA,NA,NA,NA,NA,NA,NA,NA,NA,NA,NA,"fatal and nonfatal MI was adjudicated using standardized clinical criteria that consisted of at least 2 of the following: electrocardiographic changes consistent with MI, biomarker elevations consistent with myocardial damage, and/or typical chest pain or International Classification of Diseases (ICD) codes (ICD-9 codes 410414 or equivalent).2",NA,NA,1.29,0.96,1.73,1.17,0.88,1.56,NA,NA,NA,NA,NA,NA,NA,NA,NA,NA,NA,NA,NA,NA,NA,NA,NA,NA,NA,NA,1.6,1.13,2.27,1.23,0.85,1.78
"Liu et al., 2019",https://onlinelibrary.wiley.com/doi/10.1002/dmrr.3129,James,24,0,NA,0,5.6-7.0 mmol/L,1,1,0,0,0,0,0,Rural Chinese Cohort Study,China,2019,2007-2014,6,1,"age, mean individual income (monthly), marital status, education level, smoking, drinking, physical activity, BMI, TC, TG, HDL‐C, and LDL‐C levels",17248,10439,51.65578618,50.3257017,53.69496255,0,NA,NA,NA,NA,NA,NA,NA,NA,NA,NA,NA,NA,0,292,134,,1,0.8,1.24,1.14,0.94,1.39,135,58,0.88,0.64,1.23,1.34,1,1.79,NA,NA,NA,NA,NA,NA,NA,NA,NA,NA,NA,NA,NA,NA,NA,NA,NA,NA,NA,NA,NA,NA,NA,NA,NA,NA,NA,NA,NA,NA,NA,NA,NA,NA,NA,NA,NA,NA,NA,NA,NA,NA,NA,NA,NA,NA,NA,NA,NA,NA,NA,NA,NA,NA,NA,NA,NA,NA,NA
"Tran et al., 2022",,James,25,5,ADA FPG + ADA HbA1c,1,Death without Disability,1,0,0,0,0,0,0,NIPPON DATA90,Japan,2022,1990-2012,22,1,". Model 1: adjusted for age, sex, smoking status and drinking status. Model 2: adjustments in model 1 plus cardiovascular risk factors (hypertension, hypertriglyceridemia and low high-density lipoprotein, hypercholesterolemia). Model 3: adjustments in model 1 plus body mass index. Model 4 was adjusted for all variables.",1788,1022,57.51521253,57.35107632,57.63707572,1,NA,NA,NA,NA,NA,NA,NA,NA,NA,NA,NA,NA,2,131,51,,1.61,1.05,2.49,1.49,0.99,2.25,NA,NA,NA,NA,NA,NA,NA,NA,NA,NA,NA,NA,NA,NA,NA,NA,NA,NA,NA,NA,NA,NA,NA,NA,NA,NA,NA,NA,NA,NA,NA,NA,NA,NA,NA,NA,NA,NA,NA,NA,NA,NA,NA,NA,NA,NA,NA,NA,NA,NA,NA,NA,NA,NA,NA,NA,NA,NA,NA,NA,NA,NA,NA,NA,NA,NA,NA
"Hyvarinen et al., 2009",,James,26,1,NA,1,6.1-6.9 mmol/L,0,0,0,0,1,0,0,"Finland, East-West, FINRISK-1987, FINRISK-1992, FINRISK-2002, Helsinki Policemen Study, Vantaa, [Italy, Cremona], [The Netherlands, Hoorn Study], Zuthpen Study, [Sweden, MONICA], Uppsala, [U.K., Goodinge], Newcastle",Finland,2009,NA,10.5,1,". The analysis is adjusted for age, study, BMI, total cholesterol, smoking, and hypertension status.",21706,9862,56.8,NA,NA,0,NA,NA,NA,NA,NA,NA,NA,NA,NA,NA,NA,NA,0,NA,NA,,NA,NA,NA,NA,NA,NA,NA,NA,NA,NA,NA,NA,NA,NA,55,10,2.04,0.99,4.21,1.05,0.74,1.49,NA,NA,NA,NA,NA,NA,NA,NA,NA,NA,NA,NA,NA,NA,NA,NA,NA,NA,NA,NA,NA,NA,NA,NA,NA,NA,NA,NA,NA,NA,NA,NA,NA,NA,NA,NA,NA,NA,NA,NA,NA,NA,NA,NA,NA,NA,NA,NA,NA,NA,NA
"Hyvarinen et al., 2009",,James,26,2,NA,1,7.8-11.0 mmol/L,0,0,0,0,1,0,0,"Finland, East-West, FINRISK-1987, FINRISK-1992, FINRISK-2002, Helsinki Policemen Study, Vantaa, [Italy, Cremona], [The Netherlands, Hoorn Study], Zuthpen Study, [Sweden, MONICA], Uppsala, [U.K., Goodinge], Newcastle",Finland,2009,NA,10.5,1,". The analysis is adjusted for age, study, BMI, total cholesterol, smoking, and hypertension status.",21706,9862,56.8,NA,NA,0,NA,NA,NA,NA,NA,NA,NA,NA,NA,NA,NA,NA,0,NA,NA,,NA,NA,NA,NA,NA,NA,NA,NA,NA,NA,NA,NA,NA,NA,44,9,0.9,0.43,1.9,1.43,0.97,2.11,NA,NA,NA,NA,NA,NA,NA,NA,NA,NA,NA,NA,NA,NA,NA,NA,NA,NA,NA,NA,NA,NA,NA,NA,NA,NA,NA,NA,NA,NA,NA,NA,NA,NA,NA,NA,NA,NA,NA,NA,NA,NA,NA,NA,NA,NA,NA,NA,NA,NA,NA
"Hsu et al., 2023","""Prediabetes increases the risk of major limb and cardiovascular events""",James,27,5,ADA FPG + OGTT 2hPG + ADA HbA1c,1,PreDM,0,0,1,0,0,0,0,National Taiwan University Hospital,Taiwan,2023,2014-2019,3.866666667,1,"Model 1: Crude; Model 2: Adjust age, sex, BMI, hypertension, hyperlipidemia, HF, gout, CAD, AF, eGFR",36950,20454,64.00512043,NA,NA,0,97.69169689,NA,NA,5.640243572,NA,NA,NA,NA,NA,75.10390257,NA,NA,0,NA,NA,,NA,NA,NA,NA,NA,NA,NA,NA,NA,NA,NA,NA,NA,NA,NA,NA,NA,NA,NA,NA,NA,NA,NA,NA,NA,NA,NA,NA,NA,NA,NA,NA,NA,NA,NA,NA,NA,NA,"Major adverse cardiovascular events (MACE) were defined as a combination of cardiovascular mortality, non-fatal myocardial infarction, and non-fatal ischemic stroke",678,NA,1.33,1.085,1.641,1.27,1.091,1.476,NA,NA,NA,NA,NA,NA,NA,NA,NA,NA,NA,NA,NA,NA,NA,NA,NA,NA,NA,NA,NA,NA,NA,NA,NA,NA
"Asgari et al., 2024",,James,28,0,NA,0,PreDM & Non-Obese,1,1,1,0,0,0,0,"ARIC, Multi-Ethnic Study of Atherosclerosis, Tehran Lipid and Glucose Study",Iran,2024,1987-2005,16.6,1,"Model adjusted for sex (total population), age, non-HDL-C, education levels, hypertension, FH-CVD, and prevalent CVD (except for CVD)",17433,9682,50,NA,NA,0,NA,NA,NA,NA,NA,NA,NA,NA,NA,NA,NA,NA,0,907,335,,1.17,1.03,1.34,0.96,0.86,1.08,245,86,1.22,0.93,1.59,0.91,0.73,1.13,NA,NA,NA,NA,NA,NA,NA,NA,NA,NA,NA,NA,NA,NA,NA,NA,NA,NA,NA,NA,NA,NA,NA,NA,"For TLGS: history of acute coronary syndrome leading to CCU admission, history of percutaneous coronary intervention (PCI), or coronary artery bypass graft (CABG), angiographic proven coronary artery disease (i.e.,>50% luminal narrowing of one or more coronary artery), or history of stroke events For ARIC and MESA: History of heart failure (HF), myocardial infarction (MI), coronary revascularization, stroke, or transient ischemic Attack",253,189,1.07,0.9,1.27,1.13,1,1.28,NA,NA,NA,NA,NA,NA,NA,NA,NA,NA,NA,NA,NA,NA,NA,NA,NA,NA,NA,NA,NA,NA,NA,NA,NA,NA
"Asgari et al., 2024",,James,28,0,NA,0,PreDM & Obese,1,1,1,0,0,0,0,"Atherosclerosis Risk in Communities, Multi-Ethnic Study of Atherosclerosis, Tehran Lipid and Glucose Study",Iran,2024,1987-2005,16.6,1,"Model adjusted for sex (total population), age, non-HDL-C, education levels, hypertension, FH-CVD, and prevalent CVD (except for CVD)",17433,9682,50,NA,NA,0,NA,NA,NA,NA,NA,NA,NA,NA,NA,NA,NA,NA,0,467,115,,1.16,1,1.36,1.2,1.04,1.39,154,89,1.3,0.97,1.75,1.37,1.06,1.77,NA,NA,NA,NA,NA,NA,NA,NA,NA,NA,NA,NA,NA,NA,NA,NA,NA,NA,NA,NA,NA,NA,NA,NA,"For TLGS: history of acute coronary syndrome leading to CCU admission, history of percutaneous coronary intervention (PCI), or coronary artery bypass graft (CABG), angiographic proven coronary artery disease (i.e.,>50% luminal narrowing of one or more coronary artery), or history of stroke events For ARIC and MESA: History of heart failure (HF), myocardial infarction (MI), coronary revascularization, stroke, or transient ischemic Attack",313,134,1.07,0.88,1.31,1.15,0.97,1.37,NA,NA,NA,NA,NA,NA,NA,NA,NA,NA,NA,NA,NA,NA,NA,NA,NA,NA,NA,NA,NA,NA,NA,NA,NA,NA
"Yoshida et al., 2022",,James,29,0,NA,1,100-125 mg/dL,0,0,1,1,1,0,0,ARIC,USA,2022,1990-2017,23,1,"Adjusted for age, race/ethnicity, education, body mass index, smoking, blood pressure, cholesterols, menopausal status, uric acids, and antihypertensive or lipid-lowering medications",11262,6409,56.8,56.5,57.1,1,NA,NA,NA,NA,NA,NA,NA,NA,NA,NA,NA,NA,0,NA,NA,,NA,NA,NA,NA,NA,NA,NA,NA,NA,NA,NA,NA,NA,NA,372,173,1.06,0.99,1.12,0.96,0.9,1.02,NA,NA,NA,NA,NA,NA,NA,NA,NA,NA,NA,NA,NA,NA,NA,NA,"CVD outcomes included incident coronary heart disease (CHD) comprising myocardial infarction, CHD death, cardiac procedures, ischemic or hemorrhagic stroke, and a composite atherosclerotic cardiovascular disease (ASCVD), including CHD or stroke.",1286,471,1.07,1,1.14,1,0.93,1.07,NA,1008,333,1.06,1,1.13,0.99,0.93,1.06,NA,NA,NA,NA,NA,NA,NA,NA,NA,NA,NA,NA,NA,NA,NA,NA,NA
"Yoshida et al., 2022",,James,29,3,NA,1,5.7%-6.4%,0,0,1,1,1,0,0,ARIC,USA,2022,1990-2017,23,1,"Adjusted for age, race/ethnicity, education, body mass index, smoking, blood pressure, cholesterols, menopausal status, uric acids, and antihypertensive or lipid-lowering medications",11262,6409,56.8,56.5,57.1,1,NA,NA,NA,NA,NA,NA,NA,NA,NA,NA,NA,NA,0,NA,NA,,NA,NA,NA,NA,NA,NA,NA,NA,NA,NA,NA,NA,NA,NA,260,127,1.14,1.06,1.22,1.12,1.04,1.2,NA,NA,NA,NA,NA,NA,NA,NA,NA,NA,NA,NA,NA,NA,NA,NA,"CVD outcomes included incident coronary heart disease (CHD) comprising myocardial infarction, CHD death, cardiac procedures, ischemic or hemorrhagic stroke, and a composite atherosclerotic cardiovascular disease (ASCVD), including CHD or stroke.",839,334,1.15,1.07,1.24,1.09,1,1.18,NA,658,237,1.14,1.06,1.22,1.11,1.02,1.2,NA,NA,NA,NA,NA,NA,NA,NA,NA,NA,NA,NA,NA,NA,NA,NA,NA
"Yoshida et al., 2022",,James,29,2,NA,1,7.8-11.0 mmol/L,0,0,1,1,1,0,0,ARIC,USA,2022,1990-2017,23,1,"Adjusted for age, race/ethnicity, education, body mass index, smoking, blood pressure, cholesterols, menopausal status, uric acids, and antihypertensive or lipid-lowering medications",11262,6409,56.8,56.5,57.1,1,NA,NA,NA,NA,NA,NA,NA,NA,NA,NA,NA,NA,0,NA,NA,,NA,NA,NA,NA,NA,NA,NA,NA,NA,NA,NA,NA,NA,NA,129,78,1.04,0.96,1.21,1.11,1.01,1.21,NA,NA,NA,NA,NA,NA,NA,NA,NA,NA,NA,NA,NA,NA,NA,NA,"CVD outcomes included incident coronary heart disease (CHD) comprising myocardial infarction, CHD death, cardiac procedures, ischemic or hemorrhagic stroke, and a composite atherosclerotic cardiovascular disease (ASCVD), including CHD or stroke.",441,221,1.05,0.97,1.13,1.12,1.02,1.24,NA,342,154,1.05,0.97,1.13,1.1,1,1.22,NA,NA,NA,NA,NA,NA,NA,NA,NA,NA,NA,NA,NA,NA,NA,NA,NA
"Lin et al., 2017",,James,30,5,OGTT 2hPG + WHO FPG,1,PreDM,0,0,0,0,0,0,1,REACTION,China,2017,2011-2012,10,1,"adjusted for age, BMI, physical activity, current smoking status, current drinking status, systolic blood pressure, high-density lipoprotein cholesterol, use of antihypertensive drugs, and a history of cardiovascular disease",250752,164104,57.4,56.81883318,58.46974656,0,6,5.913556038,6.112723894,6,5.80580973,5.805089558,NA,NA,NA,NA,NA,NA,2,NA,NA,,NA,NA,NA,NA,NA,NA,NA,NA,NA,NA,NA,NA,NA,NA,NA,NA,NA,NA,NA,NA,NA,NA,NA,NA,NA,NA,NA,NA,NA,NA,NA,NA,NA,NA,NA,NA,NA,NA,NA,NA,NA,NA,NA,NA,NA,NA,NA,NA,NA,NA,NA,NA,NA,NA,NA,NA,CKD was defined as eGFR <60 mL/min per 1.73 m,1395,828,1.09,0.98,1.22,1.15,1.02,1.32,NA,NA,NA,NA,NA,NA,NA,NA
"Sasaki et al., 2024",,James,31,5,ADA FPG + OGTT 2hPG,1,PreDM + Normotensive,0,1,1,1,1,1,0,Hiroshima Study,Japan,2024,1982-2014,12.4,1,"age, sex, BMI, smoking habit, drinking habit, hyperlipidemia, hyperuricemia, and renal dysfunction",16564,8487,65.8,NA,NA,0,5.816758633,NA,NA,NA,NA,NA,NA,NA,NA,75.41179667,NA,NA,0,NA,NA,,NA,NA,NA,NA,NA,NA,NA,NA,1.33,0.94,1.88,1.19,0.83,1.7,NA,NA,1.08,0.71,1.65,1.35,0.87,2.11,NA,NA,NA,NA,NA,NA,NA,NA,NA,NA,NA,NA,NA,NA,NA,NA,NA,NA,NA,1.23,0.94,1.6,1.25,0.95,1.65,NA,NA,NA,1.15,0.64,2.09,1.26,0.7,2.29,NA,NA,NA,NA,NA,NA,NA,NA,NA,NA,NA,1.41,0.88,2.28,1.37,0.8,2.33
"Sasaki et al., 2024",,James,31,5,ADA FPG + OGTT 2hPG,1,PreDM + Hypertensive,0,1,1,1,1,1,0,Hiroshima Study,Japan,2024,1982-2014,12.4,1,"age, sex, BMI, smoking habit, drinking habit, hyperlipidemia, hyperuricemia, and renal dysfunction",16564,8487,65.8,NA,NA,0,5.816758633,NA,NA,NA,NA,NA,NA,NA,NA,75.41179667,NA,NA,0,NA,NA,,NA,NA,NA,NA,NA,NA,NA,NA,1.05,0.77,1.41,0.9,0.67,1.2,NA,NA,1.37,0.92,2.02,0.93,0.66,1.3,NA,NA,NA,NA,NA,NA,NA,NA,NA,NA,NA,NA,NA,NA,NA,NA,NA,NA,NA,0.91,0.73,1.14,1.15,0.91,1.46,NA,NA,NA,1,0.64,1.57,0.93,0.56,1.55,NA,NA,NA,NA,NA,NA,NA,NA,NA,NA,NA,0.87,0.57,1.32,0.98,0.65,1.48
"Rentsch et al., 2023",,James,32,4,NA,0,PreDM,0,0,0,1,1,1,0,UK Biobank,UK,2023,2006-2010,11.8,1,"s, adjusted for age at study entry, sociodemographics (i.e., ethnicity, deprivation), lifestyle characteristics (i.e., smoking status, alcohol consumption, physical activity, body mass index, waist-hip ratio, processed meat and fruit and vegetable intake), and clinical characteristics (i.e., total cholesterol, estimated glomerular filtration rate, C-reactive protein, diagnosed hypertension, use of antihypertensive medication or statins, and family history of cardiovascular disease).",427435,273317,57.5,57.9,57.2,NA,NA,NA,NA,5.43,5.46,5.41,NA,NA,NA,NA,NA,NA,0,NA,NA,,NA,NA,NA,NA,NA,NA,NA,NA,NA,NA,NA,NA,NA,NA,3118,1290,1.14,0.99,1.32,1.04,0.92,1.19,NA,NA,NA,NA,NA,NA,NA,NA,NA,NA,NA,NA,NA,NA,NA,NA,NA,NA,NA,NA,NA,NA,NA,NA,NA,NA,3542,1004,1.12,0.97,1.3,1.15,1.04,1.27,NA,NA,NA,NA,NA,NA,NA,NA,NA,3451,1247,1.25,1.11,1.41,1.08,0.98,1.19
"Mehrabani-Zeinabad et al., 2023",,James,33,5,ADA FPG + OGTT 2hPG,1,PreDM & Normal Weight/Overweight - OBESITY DEFINED BY BMI,1,0,1,1,1,0,0,Isfahan Cohort Study,Iran,2023,2001-2017,11.25,1,"Values are adjusted for age, SBP, TG, sex, smoking status, history of heart disease, history of high blood pressure and history of diabetes.",5409,2774,50.98153818,NA,NA,1,90.42560362,NA,NA,NA,NA,NA,NA,NA,NA,NA,NA,NA,0,428,NA,,0.89,0.57,1.38,1.14,0.76,1.72,NA,NA,NA,NA,NA,NA,NA,NA,428,NA,1.9,0.91,3.94,0.74,0.29,1.88,NA,NA,NA,NA,NA,NA,NA,NA,NA,NA,NA,NA,NA,NA,NA,NA,"s fatal and non-fatal MI, fatal and non-fatal stroke, sudden cardiac death and unstable angina, based on modifed criteria of WHO Expert Committe",428,NA,0.83,0.56,1.23,1.05,0.74,1.48,"IHD included the occurrence of fatal and non-fatal MI, sudden cardiac death (SCD) and unstable angina",428,NA,0.65,0.4,1.04,1.11,0.77,1.62,NA,NA,NA,NA,NA,NA,NA,NA,NA,NA,NA,NA,NA,NA,NA,NA,NA
"Mehrabani-Zeinabad et al., 2023",,James,33,5,ADA FPG + OGTT 2hPG,1,PreDM & Normal Weight/Overweight - OBESITY DEFINED BY WC,1,0,1,1,1,0,0,Isfahan Cohort Study,Iran,2023,2001-2017,11.25,1,"Values are adjusted for age, SBP, TG, sex, smoking status, history of heart disease, history of high blood pressure and history of diabetes.",5409,2774,50.98153818,NA,NA,1,90.42560362,NA,NA,NA,NA,NA,NA,NA,NA,NA,NA,NA,0,253,NA,,1.02,0.47,2.22,1.28,0.83,1.98,NA,NA,NA,NA,NA,NA,NA,NA,253,NA,1.38,0.43,6.54,0.37,0.09,1.56,NA,NA,NA,NA,NA,NA,NA,NA,NA,NA,NA,NA,NA,NA,NA,NA,"s fatal and non-fatal MI, fatal and non-fatal stroke, sudden cardiac death and unstable angina, based on modifed criteria of WHO Expert Committe",253,NA,0.91,0.42,1.98,1.05,0.72,1.55,"IHD included the occurrence of fatal and non-fatal MI, sudden cardiac death (SCD) and unstable angina",253,NA,0.8,0.31,2.1,1.2,0.81,1.8,NA,NA,NA,NA,NA,NA,NA,NA,NA,NA,NA,NA,NA,NA,NA,NA,NA
